{
  "$schema": "https://json-schema.org/draft/2020-12/schema",
  "$id": "attention.schema.json",
  "title": "Wikipedia attention",
  "description": "data/raw/attention/YYYY-MM-DD.json (UTC day of the fetch): daily user page views of each candidate's Wikipedia article over a range of days. A later fetch of the same day replaces an earlier one in data/clean/attention.csv.",
  "type": "object",
  "additionalProperties": false,
  "required": ["schema_version", "fetched_at", "project", "start", "end", "articles"],
  "properties": {
    "schema_version": { "const": "1.0" },
    "fetched_at": { "type": "string", "pattern": "^\\d{4}-\\d{2}-\\d{2}T\\d{2}:\\d{2}:\\d{2}Z$" },
    "project": { "type": "string" },
    "start": { "$ref": "#/$defs/date" },
    "end": { "$ref": "#/$defs/date" },
    "articles": {
      "type": "array",
      "items": {
        "type": "object",
        "additionalProperties": false,
        "required": ["candidate_id", "article", "status", "error", "days"],
        "properties": {
          "candidate_id": { "type": "string", "pattern": "^[a-z][a-z0-9_]*$" },
          "article": { "type": "string", "minLength": 1 },
          "status": { "enum": ["ok", "missing", "error"] },
          "error": { "type": ["string", "null"] },
          "days": {
            "type": "array",
            "items": {
              "type": "object",
              "additionalProperties": false,
              "required": ["date", "views"],
              "properties": {
                "date": { "$ref": "#/$defs/date" },
                "views": { "type": "integer", "minimum": 0 }
              }
            }
          }
        }
      }
    }
  },
  "$defs": {
    "date": { "type": "string", "pattern": "^\\d{4}-\\d{2}-\\d{2}$" }
  }
}
