{
  "articles": [
    {
      "article": "Nathalie_Arthaud",
      "candidate_id": "arthaud",
      "days": [
        {
          "date": "2026-10-09",
          "views": 496
        },
        {
          "date": "2026-10-10",
          "views": 542
        },
        {
          "date": "2026-10-11",
          "views": 702
        },
        {
          "date": "2026-10-12",
          "views": 660
        },
        {
          "date": "2026-10-13",
          "views": 482
        },
        {
          "date": "2026-10-14",
          "views": 617
        },
        {
          "date": "2026-10-15",
          "views": 549
        }
      ],
      "error": null,
      "status": "ok"
    },
    {
      "article": "François_Asselineau",
      "candidate_id": "asselineau",
      "days": [
        {
          "date": "2026-10-09",
          "views": 1139
        },
        {
          "date": "2026-10-10",
          "views": 1191
        },
        {
          "date": "2026-10-11",
          "views": 1432
        },
        {
          "date": "2026-10-12",
          "views": 1378
        },
        {
          "date": "2026-10-13",
          "views": 1169
        },
        {
          "date": "2026-10-14",
          "views": 1664
        },
        {
          "date": "2026-10-15",
          "views": 1394
        }
      ],
      "error": null,
      "status": "ok"
    },
    {
      "article": "Gabriel_Attal",
      "candidate_id": "attal",
      "days": [
        {
          "date": "2026-10-09",
          "views": 3363
        },
        {
          "date": "2026-10-10",
          "views": 7606
        },
        {
          "date": "2026-10-11",
          "views": 14719
        },
        {
          "date": "2026-10-12",
          "views": 4674
        },
        {
          "date": "2026-10-13",
          "views": 3249
        },
        {
          "date": "2026-10-14",
          "views": 2470
        },
        {
          "date": "2026-10-15",
          "views": 2821
        }
      ],
      "error": null,
      "status": "ok"
    },
    {
      "article": "Jordan_Bardella",
      "candidate_id": "bardella",
      "days": [
        {
          "date": "2026-10-09",
          "views": 5914
        },
        {
          "date": "2026-10-10",
          "views": 4398
        },
        {
          "date": "2026-10-11",
          "views": 3929
        },
        {
          "date": "2026-10-12",
          "views": 3879
        },
        {
          "date": "2026-10-13",
          "views": 3102
        },
        {
          "date": "2026-10-14",
          "views": 2518
        },
        {
          "date": "2026-10-15",
          "views": 2594
        }
      ],
      "error": null,
      "status": "ok"
    },
    {
      "article": "Delphine_Batho",
      "candidate_id": "batho",
      "days": [
        {
          "date": "2026-10-09",
          "views": 267
        },
        {
          "date": "2026-10-10",
          "views": 292
        },
        {
          "date": "2026-10-11",
          "views": 528
        },
        {
          "date": "2026-10-12",
          "views": 505
        },
        {
          "date": "2026-10-13",
          "views": 342
        },
        {
          "date": "2026-10-14",
          "views": 435
        },
        {
          "date": "2026-10-15",
          "views": 333
        }
      ],
      "error": null,
      "status": "ok"
    },
    {
      "article": "Olivier_Becht",
      "candidate_id": "becht",
      "days": [
        {
          "date": "2026-10-09",
          "views": 262
        },
        {
          "date": "2026-10-10",
          "views": 214
        },
        {
          "date": "2026-10-11",
          "views": 502
        },
        {
          "date": "2026-10-12",
          "views": 376
        },
        {
          "date": "2026-10-13",
          "views": 304
        },
        {
          "date": "2026-10-14",
          "views": 782
        },
        {
          "date": "2026-10-15",
          "views": 372
        }
      ],
      "error": null,
      "status": "ok"
    },
    {
      "article": "Xavier_Bertrand",
      "candidate_id": "bertrand",
      "days": [
        {
          "date": "2026-10-09",
          "views": 387
        },
        {
          "date": "2026-10-10",
          "views": 425
        },
        {
          "date": "2026-10-11",
          "views": 518
        },
        {
          "date": "2026-10-12",
          "views": 497
        },
        {
          "date": "2026-10-13",
          "views": 374
        },
        {
          "date": "2026-10-14",
          "views": 435
        },
        {
          "date": "2026-10-15",
          "views": 452
        }
      ],
      "error": null,
      "status": "ok"
    },
    {
      "article": "Karim_Bouamrane",
      "candidate_id": "bouamrane",
      "days": [
        {
          "date": "2026-10-09",
          "views": 751
        },
        {
          "date": "2026-10-10",
          "views": 633
        },
        {
          "date": "2026-10-11",
          "views": 1015
        },
        {
          "date": "2026-10-12",
          "views": 765
        },
        {
          "date": "2026-10-13",
          "views": 558
        },
        {
          "date": "2026-10-14",
          "views": 642
        },
        {
          "date": "2026-10-15",
          "views": 516
        }
      ],
      "error": null,
      "status": "ok"
    },
    {
      "article": "Bernard_Cazeneuve",
      "candidate_id": "cazeneuve",
      "days": [
        {
          "date": "2026-10-09",
          "views": 524
        },
        {
          "date": "2026-10-10",
          "views": 466
        },
        {
          "date": "2026-10-11",
          "views": 725
        },
        {
          "date": "2026-10-12",
          "views": 856
        },
        {
          "date": "2026-10-13",
          "views": 568
        },
        {
          "date": "2026-10-14",
          "views": 629
        },
        {
          "date": "2026-10-15",
          "views": 460
        }
      ],
      "error": null,
      "status": "ok"
    },
    {
      "article": "Nicolas_Dupont-Aignan",
      "candidate_id": "dupont_aignan",
      "days": [
        {
          "date": "2026-10-09",
          "views": 598
        },
        {
          "date": "2026-10-10",
          "views": 678
        },
        {
          "date": "2026-10-11",
          "views": 2036
        },
        {
          "date": "2026-10-12",
          "views": 904
        },
        {
          "date": "2026-10-13",
          "views": 684
        },
        {
          "date": "2026-10-14",
          "views": 1293
        },
        {
          "date": "2026-10-15",
          "views": 1903
        }
      ],
      "error": null,
      "status": "ok"
    },
    {
      "article": "Olivier_Faure",
      "candidate_id": "faure",
      "days": [
        {
          "date": "2026-10-09",
          "views": 1405
        },
        {
          "date": "2026-10-10",
          "views": 1110
        },
        {
          "date": "2026-10-11",
          "views": 7012
        },
        {
          "date": "2026-10-12",
          "views": 3621
        },
        {
          "date": "2026-10-13",
          "views": 1125
        },
        {
          "date": "2026-10-14",
          "views": 625
        },
        {
          "date": "2026-10-15",
          "views": 509
        }
      ],
      "error": null,
      "status": "ok"
    },
    {
      "article": "Raphaël_Glucksmann",
      "candidate_id": "glucksmann",
      "days": [
        {
          "date": "2026-10-09",
          "views": 6060
        },
        {
          "date": "2026-10-10",
          "views": 5803
        },
        {
          "date": "2026-10-11",
          "views": 167351
        },
        {
          "date": "2026-10-12",
          "views": 130906
        },
        {
          "date": "2026-10-13",
          "views": 39228
        },
        {
          "date": "2026-10-14",
          "views": 22851
        },
        {
          "date": "2026-10-15",
          "views": 27018
        }
      ],
      "error": null,
      "status": "ok"
    },
    {
      "article": "Jérôme_Guedj",
      "candidate_id": "guedj",
      "days": [
        {
          "date": "2026-10-09",
          "views": 3038
        },
        {
          "date": "2026-10-10",
          "views": 1737
        },
        {
          "date": "2026-10-11",
          "views": 6972
        },
        {
          "date": "2026-10-12",
          "views": 2269
        },
        {
          "date": "2026-10-13",
          "views": 780
        },
        {
          "date": "2026-10-14",
          "views": 499
        },
        {
          "date": "2026-10-15",
          "views": 419
        }
      ],
      "error": null,
      "status": "ok"
    },
    {
      "article": "François_Hollande",
      "candidate_id": "hollande",
      "days": [
        {
          "date": "2026-10-09",
          "views": 1742
        },
        {
          "date": "2026-10-10",
          "views": 1473
        },
        {
          "date": "2026-10-11",
          "views": 3062
        },
        {
          "date": "2026-10-12",
          "views": 2882
        },
        {
          "date": "2026-10-13",
          "views": 2652
        },
        {
          "date": "2026-10-14",
          "views": 2141
        },
        {
          "date": "2026-10-15",
          "views": 1508
        }
      ],
      "error": null,
      "status": "ok"
    },
    {
      "article": "Anasse_Kazib",
      "candidate_id": "kazib",
      "days": [
        {
          "date": "2026-10-09",
          "views": 535
        },
        {
          "date": "2026-10-10",
          "views": 564
        },
        {
          "date": "2026-10-11",
          "views": 717
        },
        {
          "date": "2026-10-12",
          "views": 740